{
  "name": "Rain HUD",
  "author": "RainofLight",
  "contributors": [
    "Hypnotize"
  ],
  "social": {
    "album": "https://imgur.com/a/CZrFj"
  },
  "repo": "https://github.com/Hypnootize/Rain-Hud",
  "hash": "873d01fe31c9a05d1af3b76c95d15b69abd3a21b",
  "resources": [
    "rain-hud-banner"
  ]
}
