{
  "name": "Garm3n 8MG",
  "author": "Garm3n",
  "contributors": [
    "Hypnotize"
  ],
  "social": {
    "album": "https://imgur.com/a/0Mn7x"
  },
  "repo": "https://github.com/Hypnootize/Garm3n-8MG",
  "hash": "d2b19bd2e94205ed40256c4b61e7d9595e798b7b",
  "parent": "quakehud",
  "resources": [
    "garm3n-8mg-banner"
  ]
}
