{
  "name": "G-Mang HUD",
  "author": "G-Mang",
  "contributors": [
    "Hypnotize"
  ],
  "social": {
    "steam_group": "gmanghud",
    "album": "https://imgur.com/a/IZKZA"
  },
  "repo": "https://github.com/Hypnootize/G-Mang-Hud",
  "hash": "52fe314fdaadd926129fb9f105209d1850c5ea7c",
  "resources": [
    "g-mang-hud-banner"
  ]
}
