{
  "name": "sammyhud",
  "author": "sammy",
  "social": {
    "album": "https://imgur.com/a/P0DQaBe"
  },
  "flags": [
    "fonts",
    "menus",
    "scoreboards",
    "crosshairs",
    "minmode",
    "materials",
    "customization"
  ],
  "traits": {
    "os": [
      "windows"
    ],
    "gamemode": [
      "tournament",
      "comp",
      "arena",
      "ad",
      "ctf",
      "cp",
      "halloween",
      "koth",
      "mannpower",
      "mvm",
      "pl",
      "plr",
      "pd",
      "sd",
      "tc"
    ],
    "res": [
      "4/3",
      "16/9"
    ]
  },
  "repo": "https://github.com/sammybun/sammyhud",
  "hash": "671c8d85c6e287cf3e4c038635aeba92c036baa6",
  "resources": [
    "sammyhud-banner"
  ]
}
