{
  "name": "ColourHUD",
  "author": "MrColour",
  "social": {
    "album": "https://imgur.com/a/g7KUgL9"
  },
  "flags": [
    "fonts",
    "menus",
    "scoreboards",
    "crosshairs",
    "streamer-mode",
    "materials",
    "customization"
  ],
  "traits": {
    "os": [
      "windows",
      "linux"
    ],
    "gamemode": [
      "tournament",
      "comp",
      "arena",
      "ad",
      "ctf",
      "cp",
      "halloween",
      "koth",
      "mannpower",
      "mvm",
      "pass",
      "pl",
      "plr",
      "pd",
      "rd",
      "sd",
      "tc"
    ],
    "res": [
      "4/3",
      "5/4",
      "16/9",
      "16/10"
    ]
  },
  "repo": "https://github.com/mcolour/colourhud",
  "hash": "11e12149623f343924de90d4880362a0e8083ff0",
  "resources": [
    "colourhud-banner"
  ]
}
