{
  "name": "Bast HUD",
  "author": "b4stian",
  "contributors": [
    "Hypnotize"
  ],
  "social": {
    "steam_group": "bastHUD",
    "album": "https://imgur.com/a/gDjCp"
  },
  "repo": "https://github.com/Hypnootize/Bast-Hud",
  "hash": "ac6d68ee4aa08491b00e25b44ee87f7934650a81",
  "resources": [
    "bast-hud-banner"
  ]
}
