{
  "name": "m0re 2009",
  "author": "m0re",
  "contributors": [
    "Hypnotize"
  ],
  "social": {
    "album": "https://imgur.com/a/IcmXc"
  },
  "repo": "https://github.com/Hypnootize/m0re-Old",
  "hash": "97259d0a6f1ae41e1995c6113c1f94b7fb473b40",
  "parent": "m0rehud",
  "resources": [
    "m0re-2009-banner"
  ]
}
