{
  "name": "OMP HUD",
  "author": "OMP",
  "contributors": [
    "Hypnotize"
  ],
  "social": {
    "steam_group": "tf2hud",
    "album": "https://imgur.com/a/mCoYj"
  },
  "flags": [
    "fonts",
    "menus",
    "scoreboards",
    "crosshairs",
    "minmode",
    "materials",
    "customization"
  ],
  "traits": {
    "os": [
      "windows"
    ],
    "gamemode": [
      "tournament",
      "comp",
      "arena",
      "ad",
      "ctf",
      "cp",
      "halloween",
      "koth",
      "mannpower",
      "mvm",
      "pl",
      "plr",
      "sd",
      "tc"
    ],
    "res": [
      "16/9",
      "16/10"
    ]
  },
  "repo": "https://github.com/Hypnootize/OMP-Hud",
  "hash": "e051158f22ba1be5343eb9765451a037c8460589",
  "resources": [
    "omp-hud-banner"
  ]
}
