{
  "name": "medHUD",
  "author": "intel",
  "contributors": [
    "Hypnotize"
  ],
  "social": {
    "steam_group": "medhud",
    "album": "https://imgur.com/a/1ufBE"
  },
  "flags": [
    "fonts",
    "menus",
    "scoreboards",
    "crosshairs",
    "materials",
    "customization"
  ],
  "traits": {
    "os": [
      "windows"
    ],
    "gamemode": [
      "tournament",
      "comp",
      "arena",
      "ad",
      "ctf",
      "cp",
      "halloween",
      "koth",
      "mannpower",
      "mvm",
      "pass",
      "pl",
      "plr",
      "pd",
      "rd",
      "sd",
      "tc"
    ],
    "res": [
      "4/3",
      "5/4",
      "16/9",
      "16/10"
    ]
  },
  "repo": "https://github.com/Hypnootize/medHUD",
  "hash": "a8afa58261ea680e1b59b86a8871654cb28a0244",
  "resources": [
    "med-hud-banner"
  ]
}
