{
  "name": "ZONAhud",
  "author": "Lardox",
  "social": {
    "album": "https://imgur.com/a/ehRvn8z"
  },
  "flags": [
    "fonts",
    "menus",
    "scoreboards",
    "crosshairs",
    "minmode",
    "materials",
    "customization"
  ],
  "traits": {
    "os": [
      "windows"
    ],
    "gamemode": [
      "tournament",
      "comp",
      "arena",
      "ad",
      "ctf",
      "cp",
      "halloween",
      "koth",
      "mannpower",
      "mvm",
      "pass",
      "pl",
      "plr",
      "pd",
      "rd",
      "sd",
      "tc"
    ],
    "res": [
      "16/9"
    ]
  },
  "repo": "https://github.com/tf2huds/zonahud",
  "hash": "633ec34e176a36197230e95240325782d9114adf",
  "resources": [
    "zonahud-banner"
  ]
}
