{
  "name": "Garm3n Rex",
  "author": "Garm3n",
  "contributors": [
    "Hypnotize"
  ],
  "social": {
    "album": "https://imgur.com/a/GLD5e"
  },
  "repo": "https://github.com/Hypnootize/Garm3n-REX",
  "hash": "8916266392e7b9a748039fbd1286afd58896039f",
  "parent": "quakehud",
  "resources": [
    "garm3n-rex-banner"
  ]
}
