{
  "name": "Reverto HUD",
  "author": "Starkie",
  "contributors": [
    "E-Thug",
    "Hypnotize"
  ],
  "social": {
    "album": "https://imgur.com/a/iqXoZ"
  },
  "repo": "https://github.com/Hypnootize/Reverto-Hud",
  "hash": "d05eeece4945fd29adc4ce653e57169dc2c16adc",
  "resources": [
    "reverto-hud-banner"
  ]
}
